{
  "encounterId": "mid_biome_2_luchadores_01",
  "trackId": "mid_biome_2_clave_01",
  "enemyWave": [
    "elite_wraith",
    "drifter"
  ],
  "accentProfile": "son_clave_2_3",
  "victoryRewards": {
    "xp": 150,
    "currency": 60,
    "relicChoices": [
      "counter_charm",
      "focus_loop"
    ]
  }
}